index,text
1,This is amazing. I didn't know this feature existed!
2,How do I change the settings for this option?
3,This is a game-changer. it's so easy to use now!
4,Does this work with other devices or just this one?
5,I had a problem with this function before. but now it's fixed!
6,This is really helpful. I was struggling to figure this out on my own.
7,Is there a way to customize this function to suit my needs?
8,This feature is one of the main reasons I bought this product.
9,I love how simple and intuitive this is. great job!
10,Thank you for adding this function. it makes my life so much easier.
11,Can I disable this function if I don't need it?
12,This function is exactly what I was looking for. thanks!
13,I had no idea this feature existed. thank you for sharing!
14,This function is not working properly for me. any suggestions?
15,This is a great addition to the product. thank you for including it!
16,Can I use this function without an internet connection?
17,This is very impressive. I can't believe how fast this works!
18,I'm so glad this feature was included. it saves me so much time.
19,Is there a way to customize the settings for this function?
20,This function is so useful. it's my favorite part of the product!
21,How do I activate this function on my device?
22,I didn't expect this feature to be so powerful. it's amazing!
23,Thank you for making this function available. it's a game-changer.
24,This function is very intuitive and easy to use. great job!
25,Can I use this feature to connect to other devices as well?
26,This function has been a lifesaver for me. thank you!
27,Is there a way to set up this function to work automatically?
28,This feature is really cool. I didn't even know it was possible!
29,This function is a must-have for anyone using this product.
30,How do I troubleshoot this function if it's not working?
31,This function works seamlessly with my other devices. great job!
32,I'm impressed with how easy it is to use this function. thanks!
33,Thank you for including this feature. it's very useful!
34,This function is very reliable and works every time. thank you!
35,Is there a way to customize the appearance of this function?
36,This feature is amazing. I can't imagine using the product without it.
37,I didn't realize this function was included. it's a pleasant surprise!
38,This function has been a huge help to me. thank you!
39,Can I adjust the speed of this function to suit my needs?
40,This feature is very versatile and can be used in many ways.
41,This function is very powerful. it exceeded my expectations.
42,Thank you for making this function available. it's very helpful!
43,Is there a way to disable this function if I don't need it?
44,This feature is very user-friendly and easy to navigate.
45,I didn't know this function existed. but I'm glad I found it!
46,This function is very fast and efficient. great job!
47,Can I use this function on multiple devices at the same time?
48,This feature is a game-changer. it makes the product so much better.
49,I'm very impressed with the quality of this function. thank you!
50,This function is very intuitive
